{
  "schema_version": 1,
  "contract_id": "goreecloud.privacy-shield.provider-evidence-package.v1",
  "evidence_id": "etcd-state-candidate-docs-20261004",
  "provider_class": "state-provider",
  "provider_id": "etcd-self-hosted-multimember",
  "provider_name": "etcd self-hosted multi-member cluster",
  "provider_implementation": "etcd v3.7.2 self-hosted multi-member cluster",
  "integration_authority": "GoreeCloud/privacy-shield",
  "scope": {
    "service": "privacy-shield",
    "capability": "durable-authorization-state",
    "authority_state": [
      "consent",
      "policy_versions_and_active_pointer",
      "capability_revocation",
      "single_use_capability_consumption",
      "privacy_evidence_and_chain_head"
    ],
    "environments": [
      "production"
    ]
  },
  "evidence_ref": "evidence+sha256:c3bfaa70698e64f5191d9c9fcd9e217a8abed967ff7f6026f14190184fb2b586:github://GoreeCloud/privacy-shield/evidence/provider-evaluations/etcd-state-candidate-20261004.md",
  "artifact": {
    "digest_algorithm": "sha256",
    "digest": "c3bfaa70698e64f5191d9c9fcd9e217a8abed967ff7f6026f14190184fb2b586",
    "locator": "github://GoreeCloud/privacy-shield/evidence/provider-evaluations/etcd-state-candidate-20261004.md",
    "media_type": "text/markdown",
    "source_authority": "etcd-io/etcd official v3.7 documentation and signed v3.7.2 release",
    "collected_at": "2026-10-04T21:20:00Z",
    "valid_until": "2026-11-03T21:20:00Z"
  },
  "supports": [
    "durability",
    "restart_recovery",
    "atomic_transactions",
    "multi_writer_serializability",
    "distributed_topology",
    "fail_closed_conflict_behavior",
    "backup_restore",
    "migration_rollback",
    "access_control_isolation",
    "privacy_safe_observability",
    "evaluation-summary"
  ],
  "governance": {
    "status": "reviewed",
    "authorizing": false,
    "production_acceptance_authorized": false,
    "reviewed_at": "2026-10-04T21:30:00Z"
  },
  "privacy": {
    "credentials_in_package": false,
    "secret_material_in_package": false,
    "raw_private_payloads_in_package": false,
    "full_capability_tokens_in_package": false
  },
  "limitations": [
    "Public-source provider-capability evidence only; no GoreeCloud etcd deployment exists.",
    "Security controls such as authentication, RBAC, mutual TLS, private monitoring, and debug-surface restrictions must be explicitly configured and verified in the exact deployment.",
    "A complete candidate evaluation does not authorize provider selection, implementation, infrastructure purchase, deployment, or production acceptance."
  ]
}
